{"schema":"minihip/v1","source":"../tests/corpus/vectorAdd.cu","program":{"header":"hip/hip_runtime.h","kernels":[{"kind":"kernel","name":"vecAdd","qualifier":"__global__","params":[{"name":"a","type":"float","pointer":true},{"name":"b","type":"float","pointer":true},{"name":"c","type":"float","pointer":true},{"name":"n","type":"int","pointer":false}],"shared":[],"body":[{"kind":"let","name":"i","type":"int","value":{"kind":"binop","op":"+","left":{"kind":"binop","op":"*","left":{"kind":"builtin","name":"blockIdx.x"},"right":{"kind":"builtin","name":"blockDim.x"}},"right":{"kind":"builtin","name":"threadIdx.x"}}},{"kind":"if","cond":{"kind":"binop","op":"<","left":{"kind":"var","name":"i"},"right":{"kind":"var","name":"n"}},"then":[{"kind":"store","target":{"kind":"subscript","base":{"kind":"var","name":"c"},"index":{"kind":"var","name":"i"}},"value":{"kind":"binop","op":"+","left":{"kind":"subscript","base":{"kind":"var","name":"a"},"index":{"kind":"var","name":"i"}},"right":{"kind":"subscript","base":{"kind":"var","name":"b"},"index":{"kind":"var","name":"i"}}}}],"else":[]}]}],"host":[{"kind":"host_code","text":"#include <cstdio>","loc":"../tests/corpus/vectorAdd.cu:2:1"},{"kind":"host_code","text":"const int n = 1024;","loc":"/home/titan/projects/cuda-rocm/frontend/../tests/corpus/vectorAdd.cu:10:3"},{"kind":"host_code","text":"const size_t bytes = (size_t)n * sizeof(float);","loc":"/home/titan/projects/cuda-rocm/frontend/../tests/corpus/vectorAdd.cu:11:3"},{"kind":"host_code","text":"float *h_a = new float[n], *h_b = new float[n], *h_c = new float[n];","loc":"/home/titan/projects/cuda-rocm/frontend/../tests/corpus/vectorAdd.cu:12:3"},{"kind":"host_code","text":"for (int i = 0; i < n; ++i) {\n    h_a[i] = (float)i;\n    h_b[i] = (float)(2 * i);\n  }","loc":"/home/titan/projects/cuda-rocm/frontend/../tests/corpus/vectorAdd.cu:13:3"},{"kind":"host_code","text":"float *d_a, *d_b, *d_c;","loc":"/home/titan/projects/cuda-rocm/frontend/../tests/corpus/vectorAdd.cu:17:3"},{"kind":"api","name":"hipMalloc","args":[{"kind":"addrof","name":"d_a"},{"kind":"var","name":"bytes"}]},{"kind":"api","name":"hipMalloc","args":[{"kind":"addrof","name":"d_b"},{"kind":"var","name":"bytes"}]},{"kind":"api","name":"hipMalloc","args":[{"kind":"addrof","name":"d_c"},{"kind":"var","name":"bytes"}]},{"kind":"api","name":"hipMemcpy","args":[{"kind":"var","name":"d_a"},{"kind":"var","name":"h_a"},{"kind":"var","name":"bytes"}],"copyKind":"HostToDevice"},{"kind":"api","name":"hipMemcpy","args":[{"kind":"var","name":"d_b"},{"kind":"var","name":"h_b"},{"kind":"var","name":"bytes"}],"copyKind":"HostToDevice"},{"kind":"launch","kernel":"vecAdd","grid":{"kind":"binop","op":"/","left":{"kind":"binop","op":"+","left":{"kind":"var","name":"n"},"right":{"kind":"int","value":255}},"right":{"kind":"int","value":256}},"block":{"kind":"int","value":256},"stream":null,"args":[{"kind":"var","name":"d_a"},{"kind":"var","name":"d_b"},{"kind":"var","name":"d_c"},{"kind":"var","name":"n"}]},{"kind":"api","name":"hipDeviceSynchronize","args":[]},{"kind":"api","name":"hipMemcpy","args":[{"kind":"var","name":"h_c"},{"kind":"var","name":"d_c"},{"kind":"var","name":"bytes"}],"copyKind":"DeviceToHost"},{"kind":"host_code","text":"int bad = 0;","loc":"/home/titan/projects/cuda-rocm/frontend/../tests/corpus/vectorAdd.cu:26:3"},{"kind":"host_code","text":"for (int i = 0; i < n; ++i)\n    if (h_c[i] != h_a[i] + h_b[i]) ++bad;","loc":"/home/titan/projects/cuda-rocm/frontend/../tests/corpus/vectorAdd.cu:27:3"},{"kind":"host_code","text":"printf(bad == 0 ? \"PASS\\n\" : \"FAIL %d\\n\", bad);","loc":"/home/titan/projects/cuda-rocm/frontend/../tests/corpus/vectorAdd.cu:29:3"},{"kind":"api","name":"hipFree","args":[{"kind":"var","name":"d_a"}]},{"kind":"api","name":"hipFree","args":[{"kind":"var","name":"d_b"}]},{"kind":"api","name":"hipFree","args":[{"kind":"var","name":"d_c"}]},{"kind":"host_code","text":"delete[] h_a;","loc":"/home/titan/projects/cuda-rocm/frontend/../tests/corpus/vectorAdd.cu:33:3"},{"kind":"host_code","text":"delete[] h_b;","loc":"/home/titan/projects/cuda-rocm/frontend/../tests/corpus/vectorAdd.cu:34:3"},{"kind":"host_code","text":"delete[] h_c;","loc":"/home/titan/projects/cuda-rocm/frontend/../tests/corpus/vectorAdd.cu:35:3"},{"kind":"host_code","text":"return bad == 0 ? 0 : 1;","loc":"/home/titan/projects/cuda-rocm/frontend/../tests/corpus/vectorAdd.cu:36:3"}]},"diagnostics":[]}
